{
  "paper": "Paper 2",
  "term": "December",
  "year": 2024,
  "subject": "Social Studies",
  "language": "English",
  "questions": [
    {
      "id": "SST-Dec24-Extracted-Verified-Q31",
      "question": "Which of the following Kingdoms was established by Kadamba Mayurasharman?",
      "options": [
        "Madhya Pradesh",
        "Karnataka",
        "Rajasthan",
        "Gujarat"
      ],
      "correct_answer": "Karnataka",
      "explanation": "",
      "topic": "Unknown",
      "difficulty": "Medium",
      "attachments": []
    },
    {
      "id": "SST-Dec24-Extracted-Verified-Q32",
      "question": "Which of the following statements is/are correct about planets?",
      "options": [
        "All (A), (B) and (C)",
        "Only (A)",
        "Only (A) and (B)",
        "Only (B) and (C)"
      ],
      "correct_answer": "Only (A)",
      "explanation": "",
      "topic": "Unknown",
      "difficulty": "Medium",
      "attachments": []
    },
    {
      "id": "SST-Dec24-Extracted-Verified-Q33",
      "question": "The most important factor that influences the distribution of temperature on earth is:",
      "options": [
        "Crowded high rise buildings",
        "Insolation or Incoming Solar Radiation",
        "Seasons",
        "Asphalt of roads"
      ],
      "correct_answer": "Insolation or Incoming Solar Radiation",
      "explanation": "",
      "topic": "Unknown",
      "difficulty": "Medium",
      "attachments": []
    },
    {
      "id": "SST-Dec24-Extracted-Verified-Q34",
      "question": "Consider the following statements on the non-Brahman movement and choose the valid option: \n(a) The movement came from non-Brahman castes that had acquired access to education. \n(b) The movement argued that the Aryans were the indigenous people. \n(c) The movement came from non-Brahman castes with wealth and influence.",
      "options": [
        "Only (b) is valid.",
        "Only (a) and (c) are valid.",
        "Only (b) and (c) are valid.",
        "Only (c) is valid."
      ],
      "correct_answer": "Only (a) and (c) are valid.",
      "explanation": "",
      "topic": "Unknown",
      "difficulty": "Medium",
      "attachments": []
    },
    {
      "id": "SST-Dec24-Extracted-Verified-Q35",
      "question": "Who among the following worked with leather workers in Central India and also started Satnami Movement?",
      "options": [
        "U.B. Phadke",
        "Jyotirao Phule",
        "Ghasidas",
        "Haridas Thakur"
      ],
      "correct_answer": "Ghasidas",
      "explanation": "",
      "topic": "Unknown",
      "difficulty": "Medium",
      "attachments": []
    },
    {
      "id": "SST-Dec24-Extracted-Verified-Q36",
      "question": "What type of winds are Land and Sea breeze?",
      "options": [
        "Permanent winds",
        "Cyclone",
        "Local winds",
        "Seasonal winds"
      ],
      "correct_answer": "Local winds",
      "explanation": "",
      "topic": "Unknown",
      "difficulty": "Medium",
      "attachments": []
    },
    {
      "id": "SST-Dec24-Extracted-Verified-Q37",
      "question": "While teaching in a Social Science class, a student asks you - \"How can we measure the distance between longitudes on the Equator? What is the correct answer for such a calculation?\"",
      "options": [
        "Dividing the double length of the Equator by 90.",
        "Dividing the total length of the Equator by 180.",
        "Dividing the total length of the Equator by 360.",
        "Dividing the half length of the Equator by 360."
      ],
      "correct_answer": "Dividing the total length of the Equator by 360.",
      "explanation": "",
      "topic": "Unknown",
      "difficulty": "Medium",
      "attachments": []
    },
    {
      "id": "SST-Dec24-Extracted-Verified-Q38",
      "question": "Which of the following is the correct sequence of rock cycle ?",
      "options": [
        "Igneous Rock, Magma, Metamorphic Rock",
        "Sedimentary Rock, Metamorphic Rock, Magma",
        "Igneous Rock, Metamorphic Rock, Sedimentary Rock",
        "Magma, Metamorphic Rock, Sedimentary Rock"
      ],
      "correct_answer": "Sedimentary Rock, Metamorphic Rock, Magma",
      "explanation": "",
      "topic": "Unknown",
      "difficulty": "Medium",
      "attachments": []
    },
    {
      "id": "SST-Dec24-Extracted-Verified-Q39",
      "question": "Match the following and choose the appropriate option.\n (a) Punch marked coins                (i) Stamped glazed pottery\n (b) Northern Black polished ware      (ii) Tall double handled jars\n (c) Amphorae                          (iii) Extremely fine pottery   \n (d) Arretine ware                      (iv) Stamped with symbols using dyes\n",
      "options": [
        "(a) - (iv), (b) - (i), (c) - (iii), (d) - (ii)",
        "(a) - (iv), (b) - (i), (c) - (ii), (d) - (iii)",
        "(a) - (iv), (b) - (iii), (c) - (ii), (d) - (i)",
        "(a) - (iv), (b) - (ii), (c) - (iii), (d) - (i)"
      ],
      "correct_answer": "(a) - (iv), (b) - (iii), (c) - (ii), (d) - (i)",
      "explanation": "",
      "topic": "Unknown",
      "difficulty": "Medium",
      "attachments": []
    },
    {
      "id": "SST-Dec24-Extracted-Verified-Q40",
      "question": "Read the statements (A) and (R) carefully and choose the correct option.\n(A) : Using resources carefully and giving them time to get renewed is called resource conservation.\n(R) : Balancing the need to use resources and also conserve them for the future is called sustainable\ndevelopment.\n",
      "options": [
        "(A) is false but (R) is true.",
        "Both the statements (A) and (R) are true and (R) explains (A).",
        "Both the statements (A) and (R) are true but (R) does not explain (A).",
        "(A) is true but (R) is false. "
      ],
      "correct_answer": "Both the statements (A) and (R) are true but (R) does not explain (A).",
      "explanation": "",
      "topic": "Unknown",
      "difficulty": "Medium",
      "attachments": []
    },
    {
      "id": "SST-Dec24-Extracted-Verified-Q41",
      "question": "Which one of the following is incorrect ?",
      "options": [
        "The dissatisfaction with British rule intensified in 1870s and 1880s.",
        "The Arms Act was passed in 1878, disallowing Indians from possessing arms.",
        "The Vernacular Press Act was passed in 1880, to support the Government.",
        "In 1883, there was a furore over the attempt by the Government to introduce the Ibert Bill. "
      ],
      "correct_answer": "The Vernacular Press Act was passed in 1880, to support the Government.",
      "explanation": "",
      "topic": "Unknown",
      "difficulty": "Medium",
      "attachments": []
    },
    {
      "id": "SST-Dec24-Extracted-Verified-Q42",
      "question": "Consider the following statements about grasslands and choose the correct option.\n(A) Climate plays an important role in the formation of grasslands.\n(B) Annual rainfall is moderate in Prairies while velds could face drought in winter months.\n(C) The vegetation cover is sparse in Velds.\n(D) Velds lie in the Northern Hemisphere while Prairies in the Southern Hemisphere.\n",
      "options": [
        "All (A), (B), (C) and (D) are correct.",
        "Only (A), (B) and (C) are correct.",
        "Only (B), (C) and (D) are correct.",
        "Only (A), (O) and (D) are correct. "
      ],
      "correct_answer": "Only (A), (B) and (C) are correct.",
      "explanation": "",
      "topic": "Unknown",
      "difficulty": "Medium",
      "attachments": []
    },
    {
      "id": "SST-Dec24-Extracted-Verified-Q43",
      "question": "According to the Uttaramerur inscription, who could become a member of a Sabha ?\n(A) The owners of land from which land revenue is collected.\n(B) They should be between 25 and 70 years of age.\n(C) They should have their own houses.\n(D) They should have knowledge of the Vedas.\n",
      "options": [
        "Only (A), (C) and (D)",
        " Only (A)",
        "Only (A) and (B)",
        "Only (A) and (D)"
      ],
      "correct_answer": "",
      "explanation": "",
      "topic": "Unknown",
      "difficulty": "Medium",
      "attachments": []
    },
    {
      "id": "SST-Dec24-Extracted-Verified-Q44",
      "question": "_____ refers to a situation where a person does not have resources and opportunities that are available to other persons.",
      "options": [
        "Dispossession",
        "Hierarchy",
        "Diversification",
        "Inequality"
      ],
      "correct_answer": "Inequality",
      "explanation": "",
      "topic": "Unknown",
      "difficulty": "Medium",
      "attachments": []
    },
    {
      "id": "SST-Dec24-Extracted-Verified-Q45",
      "question": "Which of the following agricultural practices are correctly matched with their descriptions? \n(A) Subsistence Farming - Practiced to meet the needs of farmer's own family \n(B) Intensive Subsistence Agriculture - Prevalent in thickly populated areas \n(C) Shifting Cultivation - People and animals move from place to place",
      "options": [
        "All (A), (B) and (C)",
        "(A) and (B)",
        "(B) and (C)",
        "(A) and (C)"
      ],
      "correct_answer": "(A) and (B)",
      "explanation": "",
      "topic": "Unknown",
      "difficulty": "Medium",
      "attachments": []
    },
    {
      "id": "SST-Dec24-Extracted-Verified-Q46",
      "question": "Read the statements (A) and (R) and choose the appropriate option.\n(A) : Raja Rammohan Roy founded a reform association known as the Brahmo Sabha in Calcutta.\n(R) : He felt that changes were necessary in society and unjust practices needed to be done away with.",
      "options": [
        "Both (A) and (R) are false.",
        "Both (A) and (R) are true and (R) is the correct explanation of (A).",
        "Both (A) and (R) are true but (R) is not the correct explanation of (A).",
        "(A) is true but (R) is false."
      ],